Sheet: Sheet1
A1: Tasks | B1: Monday | C1: Tuesday | D1: Wednesday | E1: Thursday | F1: Friday | G1: Saturday | H1: Sunday | I1: Monday | J1: Tuesday | K1: Wednesday | L1: Thursday | M1: Friday | N1: Saturday | O1: Sunday
B2: of:=SUM([.B3:.B11]) -> 32 | C2: of:=SUM([.C3:.C11]) -> 30 | D2: of:=SUM([.D3:.D11]) -> 28 | E2: of:=SUM([.E3:.E11]) -> 28 | F2: of:=SUM([.F3:.F11]) -> 28 | G2: of:=SUM([.G3:.G11]) -> 28 | H2: of:=SUM([.H3:.H11]) -> 28 | O2: 0
A3: Basic Gui | B3: 7 | C3: 7 | D3: 7 | E3: 7 | F3: 7 | G3: 7 | H3: 7
A4: Basic World Gen | B4: 5 | C4: 5 | D4: 5 | E4: 5 | F4: 5 | G4: 5 | H4: 5
A5: View Handling | B5: 3 | C5: 3 | D5: 3 | E5: 3 | F5: 3 | G5: 3 | H5: 3
A6: Game State Increment | B6: 4 | C6: 4 | D6: 3 | E6: 3 | F6: 3 | G6: 3 | H6: 3
A7: Simple AI | B7: 3 | C7: 3 | D7: 3 | E7: 3 | F7: 3 | G7: 3 | H7: 3
A8: Resource Creation | B8: 2 | C8: 2 | D8: 2 | E8: 2 | F8: 2 | G8: 2 | H8: 2
A9: Basic Actor | B9: 4 | C9: 3 | D9: 2 | E9: 2 | F9: 2 | G9: 2 | H9: 2
A10: Basic Building | B10: 2 | C10: 1 | D10: 1 | E10: 1 | F10: 1 | G10: 1 | H10: 1
A11: Give Objects an array string so the gui and display the info nicely | B11: 2 | C11: 2 | D11: 2 | E11: 2 | F11: 2 | G11: 2 | H11: 2
B13: Monday Sheet1.B1:Sheet1.O1 | C13: Tuesday | D13: Wednesday | E13: Thursday | F13: Friday | G13: Saturday | H13: Sunday | I13: Monday | J13: Tuesday | K13: Wednesday | L13: Thursday | M13: Friday | N13: Saturday | O13: Sunday
A14: Row 2 | B14: 32 | C14: 30 | D14: 28 | E14: 28 | F14: 28 | G14: 28 | H14: 28 | I14: NaN | J14: NaN | K14: NaN | L14: NaN | M14: NaN | N14: NaN | O14: 0